{"job_title": "Senior Python Engineer", "company": "Acme Corp", "location": "Austin, TX (Hybrid)", "employment_type": "full-time", "salary_range": {"min": 130000, "max": 160000, "currency": "USD", "period": "annual"}, "required_skills": ["Python (5+ years)", "FastAPI", "Django", "Flask", "PostgreSQL", "Redis", "Docker", "Kubernetes", "AWS (EC2, S3, RDS, Lambda)", "CI/CD pipelines (GitHub Actions, Jenkins)"], "responsibilities": ["Architect and implement RESTful and GraphQL APIs using FastAPI and Django.", "Collaborate with data engineers to build ETL pipelines and ensure data quality.", "Mentor junior engineers and conduct thorough code reviews.", "Optimize system performance and drive reliability improvements (SLA > 99.9%).", "Participate in on-call rotation and incident response."], "qualifications": {"education": "Bachelor's degree in Computer Science or related field (or equivalent experience)", "years_of_experience": 5}, "benefits": ["Comprehensive health, dental, and vision insurance", "401(k) with 4% company match", "Unlimited PTO", "$2,000 annual learning & development stipend", "Remote-friendly culture with quarterly offsites"], "application_deadline": "2024-08-31", "contact_email": "careers@acmecorp.example"}
